<User xmlns:xsi="http://www.w3.org/2001/XMLSchema-instance" xsi:noNamespaceSchemaLocation="musicdata.xsd">
    <UserId>1</UserId>
    <name>john123</name>
    <email>john@example.com</email>
    <password>password</password>
    <userProfile>
        <Id>1</Id>
        <Bio>John bio</Bio>
        <ProfileImage>profile.jpg</ProfileImage>
        <Location>London</Location>
    </userProfile>
    <playlistList>
        <Playlist>
            <PlaylistId>1</PlaylistId>
            <PlaylistName>My Playlist</PlaylistName>
        </Playlist>
        <Playlist>
            <PlaylistId>2</PlaylistId>
            <PlaylistName>Japan vs Korean</PlaylistName>
        </Playlist>
    </playlistList>
    <wishlistList>
        <Wishlist>
            <WishlistId>1</WishlistId>
            <Name>john123wish</Name>
            <albums>
                <Album>
                    <AlbumId>1</AlbumId>
                    <AlbumTitle>1989</AlbumTitle>
                    <ReleaseDate>2022-01-01</ReleaseDate>
                </Album>
                <Album>
                    <AlbumId>2</AlbumId>
                    <AlbumTitle>The Book</AlbumTitle>
                    <ReleaseDate>2021-03-01</ReleaseDate>
                </Album>
            </albums>
        </Wishlist>
        <Wishlist>
            <WishlistId>2</WishlistId>
            <Name>johnjpopwish</Name>
            <albums>
                <Album>
                    <AlbumId>3</AlbumId>
                    <AlbumTitle>META</AlbumTitle>
                    <ReleaseDate>2021-05-17</ReleaseDate>
                </Album>
                <Album>
                    <AlbumId>4</AlbumId>
                    <AlbumTitle>Bokurano</AlbumTitle>
                    <ReleaseDate>2021-03-22</ReleaseDate>
                </Album>
            </albums>
        </Wishlist>
    </wishlistList>
</User>
